{
  "format": "muography-workspace",
  "schemaVersion": "2.0.0",
  "contents": "workspace",
  "roots": [],
  "release": {
    "id": "zhouning-lower-reservoir-dam@0.6.2+schema0.7.0",
    "contentHash": null
  },
  "units": {
    "length": "m",
    "angle": "deg"
  },
  "provenance": {
    "app": "muography-deployment-evaluation",
    "exportedAt": null,
    "author": "",
    "workspace": "ws-9d3f1k8m2q7x4c6v"
  },
  "detectors": [
    {
      "id": "det-2m7k9x4q1c8v5n3b",
      "name": "JW-S400-10B",
      "device": {
        "model": "JW-S400-10B",
        "layers": 3,
        "width": 0.4096,
        "height": 0.4096,
        "stripPitch": 0.0016,
        "strips": 256,
        "spacing": 0.15
      },
      "response": {
        "layerEfficiency": 0.95,
        "deadLiveFraction": 0.98,
        "angularResolutionDeg": 0.3,
        "systematicFraction": 0.03,
        "angularModel": "gaisser"
      }
    }
  ],
  "sites": [
    {
      "id": "site-7k2m9q4x1c8v5n3b",
      "name": "上层廊道观测室",
      "position": [
        12.5,
        122,
        57
      ],
      "frame": "model_frame",
      "candidateId": "obs_upper",
      "note": ""
    },
    {
      "id": "site-3b8x5k1m7q2c9v4n",
      "name": "南侧出口平台",
      "position": [
        80,
        101,
        55
      ],
      "frame": "model_frame",
      "candidateId": "site_platform_south",
      "note": ""
    }
  ],
  "stations": [
    {
      "id": "sta-1c8v5n3b7k2m9q4x",
      "name": "上层廊道 · 仰角 25°",
      "placement": {
        "kind": "site",
        "site": "site-7k2m9q4x1c8v5n3b"
      },
      "pose": {
        "azimuthDeg": 0,
        "elevationDeg": 25
      },
      "detector": "det-2m7k9x4q1c8v5n3b",
      "note": ""
    },
    {
      "id": "sta-5n3b7k2m9q4x1c8v",
      "name": "上层廊道 · 仰角 45°",
      "placement": {
        "kind": "site",
        "site": "site-7k2m9q4x1c8v5n3b"
      },
      "pose": {
        "azimuthDeg": 0,
        "elevationDeg": 45
      },
      "detector": "det-2m7k9x4q1c8v5n3b",
      "note": "Second pose at the same site"
    },
    {
      "id": "sta-8q2c9v4n3b8x5k1m",
      "name": "南侧平台 · 朝坝体",
      "placement": {
        "kind": "site",
        "site": "site-3b8x5k1m7q2c9v4n"
      },
      "pose": {
        "azimuthDeg": 135,
        "elevationDeg": 30
      },
      "detector": "det-2m7k9x4q1c8v5n3b",
      "note": ""
    }
  ],
  "deployments": [
    {
      "id": "dep-4vq8m2k7x1c9n5tb",
      "name": "上层廊道两个仰角",
      "stations": [
        "sta-1c8v5n3b7k2m9q4x",
        "sta-5n3b7k2m9q4x1c8v"
      ],
      "note": ""
    },
    {
      "id": "dep-6t1n9c5x7k2m8q4v",
      "name": "廊道 + 南侧平台",
      "stations": [
        "sta-1c8v5n3b7k2m9q4x",
        "sta-8q2c9v4n3b8x5k1m"
      ],
      "note": ""
    }
  ],
  "studies": [
    {
      "id": "study-2x7k4m9q1c5v8n3b",
      "title": "上部坝体 · 低/中水位",
      "scenes": [
        {
          "id": "low",
          "label": "低水位",
          "scenario": "low",
          "anomalies": []
        },
        {
          "id": "mid",
          "label": "中水位",
          "scenario": "mid",
          "anomalies": []
        }
      ],
      "deployments": [
        "dep-4vq8m2k7x1c9n5tb",
        "dep-6t1n9c5x7k2m8q4v"
      ],
      "exposure": {
        "kind": "constant",
        "days": 60
      },
      "aim": null,
      "basis": null,
      "note": "Compare one site with two poses against two sites."
    }
  ]
}
